{
  "$schema": "http://json-schema.org/draft-04/schema#",
  "title": "character",
  "description": "A character description file for binder",
  "type": "object",
  "additionalProperties": false,
  "required": ["Typ","ID", "Name", "Geburtsjahr"],
  "properties": {
    "Typ": {
      "type": "string"
    },
    "ID": {
      "type": "string",
      "pattern": "^[a-z][a-z0-9]*$"
    },
    "Name": {
      "type": "string"
    },
    "Tags": {
      "type": "object",
      "patternProperties": {
        "^[A-ZÄÖÜ][A-ZÄÖÜa-zäöüß]*$": {
          "type": "array",
          "items": {
            "type": "string"
          }
        }
      }
    },
    "Rolle": {
      "type": "string",
      "enum": ["primary", "recurring", "once", "mention"]
    },
    "Titel": {
      "type": "array",
      "items": {
        "type": "string"
      }
    },
    "Profession": {
      "type": "string"
    },
    "Geschlecht": {
      "type": "string",
      "enum": ["m", "w", "d"]
    },
    "Geburtsjahr": {
      "type": "integer"
    },
    "Todesjahr": {
      "type": "integer"
    },
    "Bilder": {
      "type": "array",
      "items": {
        "type": "string",
        "pattern": "^[^\\\\\\/\\.]+\\.(jpg|png)$"
      }
    },
    "Erscheinung": {
      "type": "object",
      "additionalProperties": false,
      "properties": {
        "Aussehen": {
          "type": "string"
        },
        "Kleidung": {
          "type": "string"
        },
        "Gestik": {
          "type": "string"
        },
        "Mimik": {
          "type": "string"
        },
        "Stimme": {
          "type": "string"
        },
        "Besonderheiten": {
          "type": "string"
        }
      }
    },
    "Kampagnen": {
      "type": "array",
      "items": {
        "type": "string",
        "pattern": "^[a-zäöüß]+$"
      }
    },
    "Text": {
      "type": "string"
    },
    "Inventar": {
      "type": "object",
      "patternProperties": {
        "^.*$": {
          "type": "integer"
        }
      }
    },
    "Spezies": {
      "type": "string",
      "enum": ["Mensch", "Elf", "Halbelf", "Zwerg"]
    },
    "Sprachen": {
      "type": "object",
      "patternProperties": {
        "^[a-zA-Z\\- ]+$": {
          "type": "integer"
        }
      },
      "additionalProperties": false
    },
    "Schriften": {
      "type": "array",
      "items": {
        "pattern": "^[a-zA-Z\\- ]+$"
      }
    },
    "Stats": {
      "type": "object",
      "properties": {
        "Grundwerte": {
          "type": "object",
          "patternProperties": {
            "^LeP|AsP|KaP|SK|ZK|AW|INI|GS$": {
              "type": "integer"
            }
          },
          "additionalProperties": false,
          "minProperties": 8
        },
        "Eigenschaften": {
          "type": "object",
          "patternProperties": {
            "^MU|KL|IN|CH|FF|GE|KO|KK$": {
              "type": "integer"
            }
          },
          "additionalProperties": false,
          "minProperties": 8
        },
        "Fertigkeiten": {
          "type": "object",
          "patternProperties": {
            "^[A-ZÄÖÜ][A-ZÄÖÜa-zäöüß& ]*$": {
              "type": "integer"
            }
          },
          "additionalProperties": false
        },
        "Kampftechniken": {
          "type": "object",
          "patternProperties": {
            "^[A-ZÄÖÜ][A-ZÄÖÜa-zäöüß& ]*$": {
              "type": "integer"
            }
          },
          "additionalProperties": false
        },
        "Rüstungsschutz": {
          "type": "integer"
        },
        "Waffen": {
          "type": "object",
          "additionalProperties": false,
          "properties": {
            "Nahkampf": {
              "type": "object",
              "properties": {
                "^[A-ZÄÖÜ][A-ZÄÖÜa-zäöüß& ]*$": {
                  "type": "object",
                  "additionalProperties": false,
                  "minProperties": 6,
                  "properties": {
                    "AT": {
                      "type": "integer"
                    },
                    "PA": {
                      "type": "integer"
                    },
                    "TP": {
                      "type": "array",
                      "items": {
                        "type": "integer"
                      },
                      "minItems": 2,
                      "maxItems": 2
                    },
                    "RW": {
                      "type": "string",
                      "enum": ["kurz", "mittel", "lang"]
                    },
                    "Vorteil": {
                      "type": ["string", "null"]
                    },
                    "Nachteil": {
                      "type": ["string", "null"]
                    }
                  }
                }
              }
            },
            "Fernkampf": {
              "type": "object",
              "properties": {
                "^[A-ZÄÖÜ][A-ZÄÖÜa-zäöüß& ]*$": {
                  "type": "object",
                  "additionalProperties": false,
                  "minProperties": 6,
                  "properties": {
                    "FK": {
                      "type": "integer"
                    },
                    "TP": {
                      "type": "array",
                      "items": {
                        "type": "integer"
                      },
                      "minItems": 2,
                      "maxItems": 2
                    },
                    "LZ": {
                      "type": "integer"
                    },
                    "RW": {
                      "type": "array",
                      "items": {
                        "type": "integer"
                      },
                      "minItems": 3,
                      "maxItems": 3
                    },
                    "Munition": {
                      "type": "integer"
                    },
                    "Vorteil": {
                      "type": ["string", "null"]
                    },
                    "Nachteil": {
                      "type": ["string", "null"]
                    }
                  }
                }
              }
            }
          }
        },
        "Magie": {
          "type": "object",
          "additionalProperties": false,
          "properties": {
            "Zaubersprüche": {
              "type": "object",
              "patternProperties": {
                "^[A-ZÄÖÜ][A-ZÄÖÜa-zäöüß& ]*$": {
                  "type": "array",
                  "items": [
                    {
                      "type": "integer"
                    }
                  ],
                  "additionalItems": {
                    "type": "string"
                  }
                }
              },
              "additionalProperties": false
            },
            "Rituale": {
              "type": "object",
              "patternProperties": {
                "^[A-ZÄÖÜ][A-ZÄÖÜa-zäöüß& ]*$": {
                  "type": "array",
                  "items": [
                    {
                      "type": "integer"
                    }
                  ],
                  "additionalItems": {
                    "type": "string"
                  }
                }
              },
              "additionalProperties": false
            },
            "Zaubertricks": {
              "type": "array",
              "items": {
                "type": "string"
              }
            }
          }
        },
        "Götterwirken": {
          "type": "object",
          "additionalProperties": false,
          "properties": {
            "Liturgien": {
              "type": "object",
              "patternProperties": {
                "^[A-ZÄÖÜ][A-ZÄÖÜa-zäöüß& ]*$": {
                  "type": "array",
                  "items": [
                    {
                      "type": "integer"
                    }
                  ],
                  "additionalItems": {
                    "type": "string"
                  }
                }
              },
              "additionalProperties": false
            },
            "Zeremonien": {
              "type": "object",
              "patternProperties": {
                "^[A-ZÄÖÜ][A-ZÄÖÜa-zäöüß& ]*$": {
                  "type": "array",
                  "items": [
                    {
                      "type": "integer"
                    }
                  ],
                  "additionalItems": {
                    "type": "string"
                  }
                }
              },
              "additionalProperties": false
            },
            "Segnungen": {
              "type": "array",
              "items": {
                "type": "string"
              }
            }
          }
        }
      },
      "additionalProperties": false,
      "minProperties": 7
    },
    "Vorteile": {
      "type": "object",
      "patternProperties": {
        "^[A-ZÄÖÜ][A-ZÄÖÜa-zäöüß& ]*$": {
          "type": "array",
          "items": {
            "type": ["string", "integer"]
          }
        }
      }
    },
    "Nachteile": {
      "type": "object",
      "patternProperties": {
        "^[A-ZÄÖÜ][A-ZÄÖÜa-zäöüß& ]*$": {
          "type": "array",
          "items": {
            "type": ["string", "integer"]
          }
        }
      }
    },
    "Sonderfertigkeiten": {
      "type": "object",
      "patternProperties": {
        "^[A-ZÄÖÜ][A-ZÄÖÜa-zäöüß& ]*$": {
          "type": "array",
          "items": {
            "type": ["string", "integer"]
          }
        }
      }
    },
    "Sonderregeln": {
      "type": "object",
      "patternProperties": {
        "^[A-ZÄÖÜ][A-ZÄÖÜa-zäöüß& ]*$": {
          "type": "string"
        }
      }
    }
  }
}
