[
  {
    "Typ": "character",
    "ID": "alphak",
    "Name": "Alphak",
    "Tags": { "Orte": ["Galebfurt", "Trappenfurt"] },
    "Rolle": "once",
    "Geschlecht": "m",
    "Geburtsjahr": 1023
  },
  {
    "Typ": "character",
    "ID": "growin",
    "Name": "Growin",
    "Tags": { "Orte": ["Galebfurt", "Trappenfurt"] },
    "Rolle": "once",
    "Geschlecht": "m",
    "Geburtsjahr": 1029
  }
]
