{
  "Typ": "character",
  "ID": "baronjalosch",
  "Name": "Jalosch von Gernebruch",
  "Tags": {
    "Arcs": [],
    "Orte": ["Gernebruch", "Galebfurt", "Trappenfurt"],
    "Weitere": []
  },
  "Rolle": "recurring",
  "Titel": [
    "Baron"
  ],
  "Profession": "Adliger",
  "Geschlecht": "m",
  "Geburtsjahr": 993,
  "Bilder": [
    "char_Baron.png"
  ],
  "Kampagnen": ["dasloch"],
  "Text": "Der Baron verfügt über das Dorf Gernebruch, das von seinem Vater Jarolan von Gernebruch gewaltsam aus der Baronie Trappenfurten erobert wurde. Er weiß vom Loch der Verdammten und hat 1020 dessen Wiederöffnung selbst angeordnet, als er einen politischen Widersacher hinrichten ließ.",
  "Inventar": {
  },
  "Spezies": "Mensch",
  "Sprachen": {
  },
  "Schriften": [],
  "Stats": {
    "Grundwerte": {
      "LeP": 0,
      "AsP": 0,
      "KaP": 0,
      "SK": 0,
      "ZK": 0,
      "AW": 0,
      "INI": 0,
      "GS": 0
    },
    "Eigenschaften": {
      "MU": 11,
      "KL": 15,
      "IN": 13,
      "CH": 15,
      "FF": 14,
      "GE": 10,
      "KO": 11,
      "KK": 14
    },
    "Fertigkeiten": {},
    "Kampftechniken": {
      "Armbrüste": 6,
      "Bögen": 6,
      "Wurfwaffen": 6,
      "Dolche": 6,
      "Fechtwaffen": 6,
      "Hiebwaffen": 6,
      "Kettenwaffen": 6,
      "Lanzen": 6,
      "Raufen": 6,
      "Schilde": 6,
      "Schwerter": 6,
      "Stangenwaffen": 6,
      "Zweihandhiebwaffen": 6,
      "Zweihandschwerter": 6
    },
    "Rüstungsschutz": 0,
    "Waffen": {
    },
    "Magie": {},
    "Götterwirken": {
    }
  },
  "Vorteile": {
  },
  "Nachteile": {
  },
  "Sonderfertigkeiten": {
  },
  "Sonderregeln": {
  }
}
