{
  "Typ": "character",
  "ID": "gustavus",
  "Name": "Gustavus Eibenfeld",
  "Tags": {
    "Arcs": ["Zasar"],
    "Orte": ["Gareth", "Honingen"],
    "Weitere": []
  },
  "Rolle": "recurring",
  "Titel": [],
  "Profession": "Archivar",
  "Geschlecht": "m",
  "Geburtsjahr": 1012,
  "Bilder": [
    "char_Gustavus.png"
  ],
  "Kampagnen": ["dschungelpfade", "zkin", "dasloch"],
  "Text": "Archivar der Akademie Stab und Schwert zu Gareth. Er hat eine Passion für Magiegeschichte und mächtige Artefakte, aber die meisten Akademiemagier interessieren sich nicht dafür, weshalb er oft mit Helden von außerhalb arbeitet.",
  "Inventar": {
  },
  "Spezies": "Mensch",
  "Sprachen": {
  },
  "Schriften": [],
  "Stats": {
    "Grundwerte": {
      "LeP": 0,
      "AsP": 0,
      "KaP": 0,
      "SK": 0,
      "ZK": 0,
      "AW": 0,
      "INI": 0,
      "GS": 0
    },
    "Eigenschaften": {
      "MU": 10,
      "KL": 15,
      "IN": 14,
      "CH": 10,
      "FF": 13,
      "GE": 11,
      "KO": 14,
      "KK": 12
    },
    "Fertigkeiten": {},
    "Kampftechniken": {
      "Armbrüste": 6,
      "Bögen": 6,
      "Wurfwaffen": 6,
      "Dolche": 6,
      "Fechtwaffen": 6,
      "Hiebwaffen": 6,
      "Kettenwaffen": 6,
      "Lanzen": 6,
      "Raufen": 6,
      "Schilde": 6,
      "Schwerter": 6,
      "Stangenwaffen": 6,
      "Zweihandhiebwaffen": 6,
      "Zweihandschwerter": 6
    },
    "Rüstungsschutz": 0,
    "Waffen": {
    },
    "Magie": {
      "Zaubersprüche": {
      },
      "Rituale": {
      },
      "Zaubertricks": []
    },
    "Götterwirken": {
      "Liturgien": {
      },
      "Zeremonien": {
      },
      "Segnungen": []
    }
  },
  "Vorteile": {
  },
  "Nachteile": {
  },
  "Sonderfertigkeiten": {
  },
  "Sonderregeln": {
  }
}
